{
  "persona": "executive",
  "evaluated_at": "2026-06-06T15:03:00Z",
  "page": "/analysis",
  "issues": [
    {
      "id": "M6-CRITIC-038",
      "category": "missing_state",
      "severity": "P1",
      "title": "Key Insights are not scannable",
      "description": "The Key Insights section uses bullet points with long sentences. An executive wants one-line takeaways, not paragraphs.",
      "reproduction_steps": ["Navigate to Analysis", "Read Key Insights"],
      "expected": "One-line insights like 'Arrest rate: 18.0%' or 'Domestic crimes: 12.9%'",
      "actual": "Multi-sentence bullet points",
      "file_refs": ["web/src/pages/AnalysisPage.tsx:33-52"],
      "status": "reported"
    }
  ],
  "checklist_pass": 4,
  "checklist_total": 5,
  "summary": "Analysis page has Key Insights but they are not scannable for executive review."
}
