{
  "persona": "first-timer",
  "evaluated_at": "2026-06-06T15:06:00Z",
  "page": "/crime-types",
  "issues": [
    {
      "id": "M6-CRITIC-043",
      "category": "missing_state",
      "severity": "P1",
      "title": "No explanation of what crime types mean",
      "description": "A first-time visitor sees labels like 'THEFT', 'BATTERY', 'ASSAULT' but has no idea what these categories cover or how they differ.",
      "reproduction_steps": ["Navigate to Crime Types", "Look for explanation of crime type categories"],
      "expected": "A 'What do these categories mean?' section or tooltips",
      "actual": "No explanations; raw category names only",
      "file_refs": ["web/src/pages/CrimeTypesPage.tsx:36-114"],
      "status": "reported"
    },
    {
      "id": "M6-CRITIC-044",
      "category": "missing_state",
      "severity": "P2",
      "title": "Table shows no results message when empty",
      "description": "If the 'All Crime Types' table has no rows (due to filters), there is no empty state message.",
      "reproduction_steps": ["Navigate to Crime Types", "Apply filters that return no data", "Check table"],
      "expected": "Message: 'No crime types match these filters'",
      "actual": "Empty table with no message",
      "file_refs": ["web/src/pages/CrimeTypesPage.tsx:88-111"],
      "status": "reported"
    }
  ],
  "checklist_pass": 3,
  "checklist_total": 5,
  "summary": "Crime Types page shows data but first-time visitors don't know what the categories mean."
}
