{
  "persona": "first-timer",
  "evaluated_at": "2026-06-06T15:07:00Z",
  "page": "/locations",
  "issues": [
    {
      "id": "M6-CRITIC-045",
      "category": "missing_state",
      "severity": "P1",
      "title": "Maps may show empty or broken on first load",
      "description": "The ChoroplethMap and ClusterMap components may fail to load tiles or show empty black containers on first visit. A first-time visitor may think the maps are broken.",
      "reproduction_steps": ["Navigate to Locations", "Observe map cards during initial load"],
      "expected": "Loading skeleton or spinner while map tiles load",
      "actual": "Empty black containers until tiles load; no loading indicator",
      "file_refs": ["web/src/components/maps/ChoroplethMap.tsx:128-143"],
      "status": "reported"
    },
    {
      "id": "M6-CRITIC-046",
      "category": "missing_state",
      "severity": "P2",
      "title": "No explanation of map symbols",
      "description": "A first-time visitor does not know what the dots on the cluster map represent or how the choropleth color scale works.",
      "reproduction_steps": ["Navigate to Locations", "Look at maps", "Look for legend or explanation"],
      "expected": "Map legend explaining symbols and color scale",
      "actual": "No legend or explanation",
      "status": "reported"
    }
  ],
  "checklist_pass": 3,
  "checklist_total": 5,
  "summary": "Locations page shows maps but first-time visitors may see empty states and don't understand the map symbols."
}
