{
  "persona": "executive",
  "evaluated_at": "2026-06-06T15:01:00Z",
  "page": "/crime-types",
  "issues": [
    {
      "id": "M6-CRITIC-036",
      "category": "missing_state",
      "severity": "P2",
      "title": "No 'Top 3' summary for quick executive review",
      "description": "An executive wants to know 'What are the top 3 crimes?' at a glance. The bar chart requires reading all bars.",
      "reproduction_steps": ["Navigate to Crime Types", "Try to identify top 3 crimes quickly"],
      "expected": "A 'Top 3' callout at the top of the page",
      "actual": "No summary; full bar chart required",
      "file_refs": ["web/src/pages/CrimeTypesPage.tsx:43-62"],
      "status": "reported"
    }
  ],
  "checklist_pass": 4,
  "checklist_total": 5,
  "summary": "Crime Types page is clear but lacks executive-level summary."
}
