{
  "persona": "first-timer",
  "evaluated_at": "2026-06-06T15:08:00Z",
  "page": "/analysis",
  "issues": [
    {
      "id": "M6-CRITIC-047",
      "category": "missing_state",
      "severity": "P1",
      "title": "No explanation of what 'Analysis' means",
      "description": "A first-time visitor navigates to 'Analysis' but doesn't know how it differs from 'Dashboard'. The subtitle 'Deep dive into crime patterns' is vague.",
      "reproduction_steps": ["Navigate to Analysis", "Look for explanation of what this page offers"],
      "expected": "A brief explanation: 'This page provides deeper analysis of crime patterns, trends, and comparisons'",
      "actual": "Vague subtitle 'Deep dive into crime patterns'",
      "file_refs": ["web/src/pages/AnalysisPage.tsx:17-21"],
      "status": "reported"
    },
    {
      "id": "M6-CRITIC-048",
      "category": "missing_state",
      "severity": "P2",
      "title": "No empty state for Key Insights",
      "description": "If overview data is loading or unavailable, the Key Insights section may show dashes or empty values without explanation.",
      "reproduction_steps": ["Navigate to Analysis", "Check Key Insights during loading"],
      "expected": "Loading skeleton for Key Insights section",
      "actual": "No loading state; shows dashes during loading",
      "file_refs": ["web/src/pages/AnalysisPage.tsx:33-52"],
      "status": "reported"
    }
  ],
  "checklist_pass": 3,
  "checklist_total": 5,
  "summary": "Analysis page is clear but first-time visitors don't know how it differs from Dashboard."
}
