{
  "persona": "citizen",
  "evaluated_at": "2026-06-06T14:50:00Z",
  "page": "/",
  "issues": [
    {
      "id": "M6-CRITIC-011",
      "category": "confusing_label",
      "severity": "P1",
      "title": "KPI labels use technical jargon",
      "description": "Labels like 'Arrest Rate', 'Domestic %', and 'YoY Change' are not explained. A citizen doesn't know what 'domestic' means in this context or what 'YoY' stands for.",
      "reproduction_steps": ["Navigate to Dashboard", "Read KPI labels"],
      "expected": "Labels like 'What % of crimes lead to arrest?' or 'Crimes involving family/household'",
      "actual": "Technical labels: 'Arrest Rate', 'Domestic %', 'YoY Change'",
      "file_refs": ["web/src/pages/DashboardPage.tsx:47-71"],
      "status": "reported"
    },
    {
      "id": "M6-CRITIC-012",
      "category": "missing_state",
      "severity": "P2",
      "title": "No 'What am I looking at?' section",
      "description": "First-time visitors have no explanation of what the dashboard shows, where the data comes from, or what time period it covers.",
      "reproduction_steps": ["Navigate to Dashboard as a new user", "Look for any introductory text or help section"],
      "expected": "A collapsible 'About this data' section explaining the dashboard purpose",
      "actual": "No introductory text; page starts with KPI cards immediately",
      "file_refs": ["web/src/pages/DashboardPage.tsx:28-36"],
      "status": "reported"
    },
    {
      "id": "M6-CRITIC-013",
      "category": "confusing_label",
      "severity": "P2",
      "title": "Heatmap color legend is not intuitive",
      "description": "The 'Crimes by Hour of Day' heatmap uses indigo shades but there is no label explaining what darker/lighter means. A citizen may not know that darker = more crimes.",
      "reproduction_steps": ["Navigate to Dashboard", "View heatmap", "Look for color legend explanation"],
      "expected": "Legend with labels: 'Lighter = fewer crimes, Darker = more crimes'",
      "actual": "Color bar at bottom with no text explanation",
      "file_refs": ["web/src/components/charts/HourlyHeatmap.tsx:57-68"],
      "status": "reported"
    },
    {
      "id": "M6-CRITIC-014",
      "category": "missing_state",
      "severity": "P3",
      "title": "No data freshness indicator",
      "description": "There is no indication of when the data was last updated. A citizen doesn't know if this is current or historical.",
      "reproduction_steps": ["Navigate to Dashboard", "Look for 'Last updated' or 'Data as of' text"],
      "expected": "A footer or header showing data freshness (e.g., 'Data as of 2026-05-31')",
      "actual": "No data freshness indicator anywhere on the page",
      "status": "reported"
    }
  ],
  "checklist_pass": 2,
  "checklist_total": 5,
  "summary": "Dashboard shows real data but uses technical jargon, lacks explanations, and has no onboarding for first-time visitors."
}
