{
  "persona": "data-analyst",
  "evaluated_at": "2026-06-06T14:45:00Z",
  "page": "/",
  "issues": [
    {
      "id": "M6-CRITIC-001",
      "category": "missing_feature",
      "severity": "P1",
      "title": "No drill-down from KPI to underlying records",
      "description": "KPI cards show aggregated numbers (Total Crimes: 57,931) but clicking them does nothing. A data analyst needs to see the underlying breakdown.",
      "reproduction_steps": ["Navigate to Dashboard", "View KPI card 'Total Crimes'", "Click on the number"],
      "expected": "Clicking KPI shows a modal or navigates to a filtered view of the underlying data",
      "actual": "No click handler; KPI cards are static display-only",
      "file_refs": ["web/src/components/charts/KpiCard.tsx:39"],
      "status": "reported"
    },
    {
      "id": "M6-CRITIC-002",
      "category": "missing_feature",
      "severity": "P2",
      "title": "Timeseries chart lacks granularity toggle",
      "description": "Daily granularity is hardcoded. A data analyst may want weekly or monthly aggregation to see longer-term trends.",
      "reproduction_steps": ["Navigate to Dashboard", "View 'Daily Crime Trend' chart", "Look for granularity toggle"],
      "expected": "Toggle button to switch between daily/weekly/monthly view",
      "actual": "Only daily granularity available",
      "file_refs": ["web/src/components/charts/TimeseriesChart.tsx:14-92"],
      "status": "reported"
    },
    {
      "id": "M6-CRITIC-003",
      "category": "missing_feature",
      "severity": "P2",
      "title": "No data export capability",
      "description": "No way to export chart data as CSV/JSON. Data analysts need to pull numbers into spreadsheets for reports.",
      "reproduction_steps": ["Navigate to Dashboard", "Right-click on any chart", "Look for 'Export' option"],
      "expected": "Export button or context menu option to download data",
      "actual": "No export functionality anywhere on the page",
      "status": "reported"
    },
    {
      "id": "M6-CRITIC-004",
      "category": "visual_glitch",
      "severity": "P2",
      "title": "Offense bar chart truncates long type names",
      "description": "Crime types longer than 18 characters are truncated with '...'. The full name is only shown in tooltip on hover.",
      "reproduction_steps": ["Navigate to Dashboard", "View 'Top Crime Types' chart", "Look for truncated labels"],
      "expected": "Full type name visible without hover",
      "actual": "Labels truncated at 18 chars (e.g., 'OFFENSE INVOLV...')",
      "file_refs": ["web/src/components/charts/OffenseBarChart.tsx:29"],
      "status": "reported"
    }
  ],
  "checklist_pass": 3,
  "checklist_total": 5,
  "summary": "Dashboard shows correct aggregate numbers but lacks drill-down, export, and granularity controls needed for serious analysis."
}
