{
  "persona": "data-analyst",
  "evaluated_at": "2026-06-06T14:48:00Z",
  "page": "/analysis",
  "issues": [
    {
      "id": "M6-CRITIC-009",
      "category": "missing_feature",
      "severity": "P1",
      "title": "Key Insights are static text, not interactive",
      "description": "The 'Key Insights' section shows hardcoded text that references overview data. A data analyst expects these to be dynamic and clickable.",
      "reproduction_steps": ["Navigate to Analysis", "View 'Key Insights' section", "Try clicking on any insight"],
      "expected": "Insights are dynamically generated and clickable to drill down",
      "actual": "Static text with interpolated values; no interactivity",
      "file_refs": ["web/src/pages/AnalysisPage.tsx:33-52"],
      "status": "reported"
    },
    {
      "id": "M6-CRITIC-010",
      "category": "missing_feature",
      "severity": "P2",
      "title": "Analysis page duplicates Dashboard without additional depth",
      "description": "Analysis page shows the same TimeseriesChart and ArrestRateChart as Dashboard. A data analyst expects deeper analysis (correlations, distributions, comparisons).",
      "reproduction_steps": ["Navigate to Analysis", "Compare charts with Dashboard"],
      "expected": "Additional analytical views (distribution plots, correlation matrix, comparison tables)",
      "actual": "Same charts as Dashboard with stat cards on top",
      "file_refs": ["web/src/pages/AnalysisPage.tsx:7-55"],
      "status": "reported"
    }
  ],
  "checklist_pass": 4,
  "checklist_total": 5,
  "summary": "Analysis page is a thin wrapper around Dashboard charts without deeper analytical capability."
}
