{
  "persona": "citizen",
  "evaluated_at": "2026-06-06T14:53:00Z",
  "page": "/analysis",
  "issues": [
    {
      "id": "M6-CRITIC-020",
      "category": "confusing_label",
      "severity": "P1",
      "title": "Key Insights uses technical terms without explanation",
      "description": "The insight 'The overall arrest rate is 18.0%, indicating that roughly 1 in 5 crimes result in an arrest' is clear, but 'domestic in nature' is not explained.",
      "reproduction_steps": ["Navigate to Analysis", "Read Key Insights", "Find 'domestic in nature'"],
      "expected": "Plain language explanation of what 'domestic' means",
      "actual": "Technical term used without explanation",
      "file_refs": ["web/src/pages/AnalysisPage.tsx:47-49"],
      "status": "reported"
    },
    {
      "id": "M6-CRITIC-021",
      "category": "missing_state",
      "severity": "P2",
      "title": "No 'What does this mean for me?' context",
      "description": "A citizen wants to know: 'Is my neighborhood safe?' The Analysis page doesn't provide geographic context or actionable takeaways.",
      "reproduction_steps": ["Navigate to Analysis", "Look for actionable insights"],
      "expected": "Context like 'Your district has X crimes per 1000 residents' or 'Crime is Y% higher in your area'",
      "actual": "No personalized or geographic context",
      "status": "reported"
    }
  ],
  "checklist_pass": 3,
  "checklist_total": 5,
  "summary": "Analysis page has some clear insights but uses technical terms and lacks actionable context for citizens."
}
